Título,Organización,Tipo,Región,País,Fecha límite,Enlace,Afinidad,Prioridad,Estado,Monto estimado (USD),Consultor,Observaciones,Socio vinculado,Votos descarte
Call 2026,FONTAGRO,Ambos,América Latina y Caribe,—,A verificar,https://fontagro.org/en/iniciativas/convocatorias/convocatoria-2026,Ambos,Media,Identificada,,—,,,
Study Nutrition Policies in LAC,UNGM / ONU,Ambos,América Latina y Caribe,—,A verificar,https://www.ungm.org/Public/Notice/255070,Ambos,Media,Identificada,,—,,,
https://stip.oecd.org/ws/STIP/API/getPolicyInitiat...,OCDE / OECD,Ambos,Global,—,A verificar,https://stip.oecd.org/ws/STIP/API/getPolicyInitiatives.xqy?format=csv&th=TH1&br-extra=BR9,Ambos,Media,Identificada,,—,,,
106071-WP-PUBLIC-Irrigation-PPP-Toolkit.txt - Documents & Reports,Banco Mundial,Ambos,Global,—,A verificar,https://documents1.worldbank.org/curated/en/860801468196192167/txt/106071-WP-PUBLIC-Irrigation-PPP-Toolkit.txt,Ambos,Media,Identificada,,—,,,
OIG Oversight: Economic Growth and Trade | Office of Inspector General,USAID,Ambos,Caribe – Haití,—,A verificar,https://oig.usaid.gov/eco-growth-trade,Ambos,Media,Identificada,,—,,,
grants - World Bank Document,Banco Mundial,Ambos,Caribe,—,A verificar,https://documents1.worldbank.org/curated/en/727801649959720809/pdf/Grenada-Saint-Lucia-Saint-Vincent-and-the-Grenadines-Unleashing-the-Blue-Economy-of-the-Caribbean-Project.pdf,Ambos,Media,Identificada,,—,,,
"Call for research projects on adaptation in the Mediterranean region (water, agriculture and food security, coastal areas, conflict zones) | AFD - Agence Française de Développement",AFD / Expertise France,Ambos,Global,—,30 April 2028,https://www.afd.fr/en/calls-for-projects/research-projects-climate-adaptation-mediterranean-region,Ambos,Alta,Identificada,,—,,,
Convocatoria a proyectos de investigación sobre desarrollo sustentable - Plataforma Bio-emprender,IICA,Ambos,Caribe,—,A verificar,https://bio-emprender.iica.int/iica-opportunities/convocatoria-a-proyectos-de-investigacion-sobre-desarrollo-sustentable,Ambos,Media,Identificada,,—,,,
[DOC] TOR - Consultant for BariaChocolate DOCX (0.09 MB) - Helvetas,Helvetas,Ambos,Global,—,A verificar,https://www.helvetas.org/TOR-Consultant-for-BariaChocolate_download_46359,Ambos,Media,Identificada,,—,,,
National Consultants for Tourism Research and Development,Helvetas,Ambos,Global,—,A verificar,https://www.helvetas.org/en/vietnam/who-we-are/jobs/National-Consultants-for-Tourism-Research-and-Development_job_11749,Ambos,Media,Identificada,,—,,,
Generative AI for Agriculture (GAIA) – Phase I & II | IFPRI,IFPRI,Ambos,Global,—,A verificar,https://www.ifpri.org/project/generative-ai-for-agriculture-gaia,Ambos,Media,Identificada,,—,,,
Asamoah Larbi | Consultant - Devex,Devex,Ambos,Global,—,A verificar,https://www.devex.com/people/asamoah-l-1398344,Ambos,Media,Identificada,,—,,,
Work With Us: Opportunities at IFPRI,IFPRI,Ambos,Global,—,A verificar,https://www.ifpri.org/landing/work-with-us,Ambos,Media,Identificada,,—,,,
Consortium Executive Director - SPARC | Devex,Devex,Firma,Global,—,A verificar,https://www.devex.com/jobs/consortium-executive-director-sparc-1126473,Empresarial,Media,Identificada,,—,,,
Environment | IDRC - International Development Research Centre,IDRC,Ambos,Global,—,A verificar,https://idrc-crdi.ca/en/topics/environment,Ambos,Media,Identificada,,—,,,
Call For Applications: Climate Finance Roster of Experts - Devex,Devex,Ambos,América Latina y Caribe,—,A verificar,https://www.devex.com/jobs/call-for-applications-climate-finance-roster-of-experts-1339599,Ambos,Media,Identificada,,—,,,
"Program Director, Regenerative Agriculture Program - Devex",Devex,Ambos,Caribe,—,5 March 2025,https://www.devex.com/jobs/program-director-regenerative-agriculture-program-1316384,Ambos,Alta,Identificada,,—,,,
NKEs in Sustainable urban development (EU UDTF-NKE-01) - Devex,Devex,Ambos,Global,—,A verificar,https://www.devex.com/jobs/non-key-experts-pool-nkes-in-sustainable-urban-development-eu-udtf-nke-01-1069924,Ambos,Media,Identificada,,—,,,
Data and Artificial Intelligence Consultant for Governance Innovation Forum (UNDP-MNE-00831),UNDP – UNDP-MNE/MONTENEGRO,Ambos,Global,—,26-Jun-2026,https://procurement-notices.undp.org/view_negotiation.cfm?nego_id=46503,Ambos,Alta,Identificada,,—,,,
Economic Assessment for Multi-Sectoral Value Chain (Designed in 7 Lots) (UNDP-SYR-00630),UNDP – UNDP-SYR/SYRIAN ARAB REPUBLIC,Ambos,Global,—,28-Jun-2026,https://procurement-notices.undp.org/view_negotiation.cfm?nego_id=46497,Ambos,Alta,Identificada,,—,,,
Natl Consultant to Conduct Comparative Policy and Systems Review (GRP) (UNDP-LAO-00695),UNDP – UNDP-LAO/LAO PDR,Ambos,Global,—,24-Jun-2026,https://procurement-notices.undp.org/view_negotiation.cfm?nego_id=46466,Ambos,Alta,Identificada,,—,,,
140_Training programme for MSMEs on Business Innovation and Access to Finance (UNDP-UKR-01688),UNDP – UNDP-UKR/UKRAINE,Ambos,Global,—,25-Jun-2026,https://procurement-notices.undp.org/view_negotiation.cfm?nego_id=46476,Ambos,Alta,Identificada,,—,,,
IC/2026/050 - National Consultant for Revenue Analysis & Policy (UNDP-MNG-00676),UNDP – UNDP-MNG/MONGOLIA,Ambos,Global,—,25-Jun-2026,https://procurement-notices.undp.org/view_negotiation.cfm?nego_id=46483,Ambos,Alta,Identificada,,—,,,
ADG- IC- Acompañamiento a procesos de fortalecimiento institucional (Pasto) (UNDP-COL-03302),UNDP – UNDP-COL/COLOMBIA,Ambos,América del Sur – Colombia,—,25-Jun-2026,https://procurement-notices.undp.org/view_negotiation.cfm?nego_id=46459,Ambos,Alta,Identificada,,—,,,
ADG- IC- Acompañamiento a procesos de fortalecimiento institucional (Medellín) (UNDP-COL-03303),UNDP – UNDP-COL/COLOMBIA,Ambos,América del Sur – Colombia,—,25-Jun-2026,https://procurement-notices.undp.org/view_negotiation.cfm?nego_id=46460,Ambos,Alta,Identificada,,—,,,
National Consultant for Policy and Institutional Review & Biodiversity Finance (UNDP-FJI-00778),UNDP – UNDP-FJI/FIJI,Ambos,Global,—,23-Jun-2026,https://procurement-notices.undp.org/view_negotiation.cfm?nego_id=46349,Ambos,Alta,Identificada,,—,,,
"UNDP-PAN-00990 Especialista Fortalecimiento Académico, Institucional, Gobernanza (UNDP-PAN-00990)",UNDP – UNDP-PAN/PANAMA,Ambos,Centroamérica – Panamá,—,23-Jun-2026,https://procurement-notices.undp.org/view_negotiation.cfm?nego_id=46389,Ambos,Alta,Identificada,,—,,,
"UNDP-IC-2026-145- Research Analyst-Agriculture, Water Resources and Ener- Punjab (UNDP-PAK-01637)",UNDP – UNDP-PAK/PAKISTAN,Ambos,Global,—,24-Jun-2026,https://procurement-notices.undp.org/view_negotiation.cfm?nego_id=46363,Ambos,Alta,Identificada,,—,,,
"UNDP/RFP/20/2026-RERAS-Support in Agriculture W-AIMS and Resilience Planning (UNDP-NPL-00676,1)",UNDP – UNDP-NPL/NEPAL,Firma,Global,—,19-Jun-2026,https://procurement-notices.undp.org/view_negotiation.cfm?nego_id=46121,Empresarial,Alta,Identificada,,—,,,
"Wool handloom value chain, Livelihood Enterprise Development & Community Cons (UNDP-IND-00772,2)",UNDP – UNDP-IND/INDIA,Ambos,Global,—,15-Jun-2026,https://procurement-notices.undp.org/view_negotiation.cfm?nego_id=45879,Ambos,Alta,Identificada,,—,,,
Convocatorias de propuestas,IFAD / FIDA,Ambos,Global,—,14 marzo 2024,https://www.ifad.org/es/convocatorias-de-propuestas,Ambos,Alta,Identificada,,—,,,
BID | Convocatorias,IDB / BID,Ambos,Caribe,—,A verificar,https://www.iadb.org/es/como-trabajar-juntos/convocatorias,Ambos,Media,Identificada,,—,,,
Company/Team for a Diagnostic of informality in a Cambodian Agri-food Sub-Sector,UNGM / ONU,Firma,Global,—,A verificar,https://www.ungm.org/Public/notice/214712,Empresarial,Media,Identificada,,—,,,
"Call for External Collaborator –Support the implementation of the ILO work on gender equality and women economic empowerment, with specific focus on care economy, value chain interventions, violence and harassment at the workplace based on Karnali Province",UNGM / ONU,Ambos,América Latina y Caribe,—,A verificar,https://www.ungm.org/Public/Notice/290650,Ambos,Media,Identificada,,—,,,
Procurement opportunities - UNGM,UNGM / ONU,Ambos,Global,—,14-Jun-2026,https://www.ungm.org/public/notice,Ambos,Alta,Identificada,,—,,,
Employment at ECLAC | Economic Commission for Latin America and the Caribbean,CEPAL,Ambos,América Latina y Caribe,—,A verificar,https://www.cepal.org/en/employment,Ambos,Media,Identificada,,—,,,
"Cluster 6: Food, Bioeconomy, Natural Resources, Agriculture and ...",Comisión Europea,Ambos,Europa – Sede OI,—,A verificar,https://research-and-innovation.ec.europa.eu/funding/funding-opportunities/funding-programmes-and-open-calls/horizon-europe/cluster-6-food-bioeconomy-natural-resources-agriculture-and-environment_en,Ambos,Media,Identificada,,—,,,
CEPAL expuso en taller internacional para acordar e impulsar nuevas políticas públicas para la transformación de los sistemas agroalimentarios en América Latina y el Caribe | CEPAL,CEPAL,Ambos,Centroamérica – Costa Rica,—,A verificar,https://www.cepal.org/es/notas/cepal-expuso-taller-internacional-acordar-impulsar-nuevas-politicas-publicas-la-transformacion,Ambos,Media,Identificada,,—,,,
Eugenio Diaz-Bonilla | IFPRI,IFPRI,Ambos,Global,—,A verificar,https://www.ifpri.org/profile/eugenio-diaz-bonilla,Ambos,Media,Identificada,,—,,,
Noticias - en - IICA,IICA,Ambos,América Latina y Caribe,—,A verificar,https://iica.int/en/news?ucterms=countries%3Aantiguaandbarbuda,Ambos,Media,Identificada,,—,,,
Caribbean fishing industry ends meeting on upgrading food safety ...,CARICOM,Ambos,Centroamérica – Belice,—,A verificar,https://caricom.org/caribbean-fishing-industry-ends-meeting-on-upgrading-food-safety-systems,Ambos,Media,Identificada,,—,,,
"COMMUNIQUE | Forty-ninth (49th) Regular Meeting of the Conference of Heads of Government of the Caribbean Community | Montego Bay, Jamaica - CARICOM",CARICOM,Ambos,Caribe,—,A verificar,https://caricom.org/communique-forty-ninth-49th-regular-meeting-of-the-conference-of-heads-of-government-of-the-caribbean-community-montego-bay-jamaica,Ambos,Media,Identificada,,—,,,
Rural Policy Review of Ireland 2026 (EN),OCDE / OECD,Ambos,Global,—,A verificar,https://www.oecd.org/content/dam/oecd/en/publications/reports/2026/02/rural-policy-review-of-ireland-2026_9b8dbfbc/d53ea78f-en.pdf,Ambos,Media,Identificada,,—,,,
Inicio - aecid.es,AECID,Ambos,América Latina y Caribe,—,A verificar,https://www.aecid.es,Ambos,Media,Identificada,,—,,,
"Call for research projects on adaptation in the Mediterranean region (water, agriculture and food security, coastal areas, conflict zones, health) | AFD - Agence Française de Développement",AFD / Expertise France,Ambos,Global,—,30 April 2028,https://www.afd.fr/en/calls-for-projects/research-projects-climate-adaptation-mediterranean-region,Ambos,Alta,Identificada,,—,,,
IDU-153c3624-dfbb-4af5-8026-4fa4c0aa117c.txt,Banco Mundial,Ambos,Global,—,A verificar,https://documents1.worldbank.org/curated/en/099408508202433738/txt/IDU-153c3624-dfbb-4af5-8026-4fa4c0aa117c.txt,Ambos,Media,Identificada,,—,,,
Consultancy on Trade Promotion Capacity Building and - Helvetas,Helvetas,Ambos,Global,—,A verificar,https://www.helvetas.org/en/vietnam/who-we-are/jobs/Consultancy-on-Trade-Promotion-Capacity-Building-and-Process-Documentation_job_14731,Ambos,Media,Identificada,,—,,,
Consultancy for Cadmium Reduction Solutions in Mekong,Helvetas,Ambos,Global,—,A verificar,https://www.helvetas.org/en/vietnam/who-we-are/jobs/Consultancy-for-Cadmium-Reduction-Solutions-in-Mekong-Delta-region_job_12770,Ambos,Media,Identificada,,—,,,
Consultancy on Alcohol Production | Helvetas,Helvetas,Ambos,Global,—,A verificar,https://www.helvetas.org/en/vietnam/who-we-are/jobs/Consultancy-on-Alcohol-Production_job_12808,Ambos,Media,Identificada,,—,,,
McKnight Welcomes Beyene Gessesse as International Program ...,McKnight Foundation,Ambos,Global,—,A verificar,https://www.mcknight.org/news-ideas/mcknight-welcomes-beyene-gessesse-international-program-officer,Ambos,Media,Identificada,,—,,,
Supply Chain Monitoring and Evaluation Partnerships | Rainforest Alliance,Rainforest Alliance,Ambos,Global,—,A verificar,https://www.rainforest-alliance.org/resource-item/supply-chain-monitoring-and-evaluation-partnerships,Ambos,Media,Identificada,,—,,,
Indicator Annex v1.1 - the Rainforest Alliance Knowledge Hub,Rainforest Alliance,Ambos,Global,—,A verificar,https://knowledge.rainforest-alliance.org/docs/indicator-annex-v11,Ambos,Media,Identificada,,—,,,
EXPRESSION OF INTEREST (EOI) PROVISION OF CONSULTANCY SERVICES TO UNDERTAKE SCALING WEEK 2026 | International Livestock Research Institute,ILRI,Ambos,Global,—,24 September 2026,https://www.ilri.org/tenders/expression-interest-eoi-provision-consultancy-services-undertake-scaling-week-2026,Ambos,Alta,Identificada,,—,,,
Tenders | International Livestock Research Institute,ILRI,Ambos,Global,—,22 Mar 2026,https://www.ilri.org/tenders,Ambos,Alta,Identificada,,—,,,
Homepage,ILRI,Ambos,Global,—,A verificar,https://www.ilri.org,Ambos,Media,Identificada,,—,,,
English Text (483.17 KB) - Open Knowledge Repository,Banco Mundial,Ambos,Global,—,A verificar,https://openknowledge.worldbank.org/bitstreams/8e452f1a-913b-5a14-9220-eecdfd6fe7d3/download,Ambos,Media,Identificada,,—,,,
"FAO Country Profiles | FAO hosts workshop on developing a robust, science-based National Strategy and Contingency Plan for wheat rust disease prevention and management | Food and Agriculture Organization of the United Nations",FAO,Ambos,Global,—,A verificar,https://www.fao.org/countryprofiles/news-archive/detail-news/en/c/1734046,Ambos,Media,Identificada,,—,,,
Lime profitability calculator is an app developed to evaluate the ...,FAO,Ambos,Global,—,A verificar,https://sti-portal.fao.org/innovations/lime-profitability-calculator-app-developed-evaluate-profitability-agricultural-lime,Ambos,Media,Identificada,,—,,,
International Fund for Agricultural Development,UNGM / ONU,Ambos,Global,—,A verificar,https://www.ungm.org/Shared/KnowledgeCenter/Pages/IFAD,Ambos,Media,Identificada,,—,,,
Consultancy Service for the Provision of Technical Assistance ...,UNGM / ONU,Ambos,Global,—,A verificar,https://www.ungm.org/Public/Notice/284725,Ambos,Media,Identificada,,—,,,
Expression of Interest for Ulimi ndi Chilengedwe m’Malawi (UCHI) Strengthening Agriculture Commercialisation Project in Malawi - Off taking and Mentorship. (98851),UNDP – UNDP CO/MALAWI,Ambos,Cono Sur – Chile,—,30-Jun-2026,https://procurement-notices.undp.org/view_notice.cfm?notice_id=98851,Ambos,Alta,Identificada,,—,,,
"Responsible party for policy dialogue, advocacy & CSO engagement under the proj (UNDP-JOR-00679)",UNDP – UNDP-JOR/JORDAN,Ambos,Global,—,25-Jun-2026,https://procurement-notices.undp.org/view_negotiation.cfm?nego_id=46599,Ambos,Alta,Identificada,,—,,,
RFP_006_2026_Natl Firm to support financial institutions strengthening_FARM (UNDP-LAO-00694),UNDP – UNDP-LAO/LAO PDR,Firma,Global,—,01-Jul-2026,https://procurement-notices.undp.org/view_negotiation.cfm?nego_id=46530,Empresarial,Alta,Identificada,,—,,,
GOB Caracterización territorial y línea base para la reconversión productiva ... (UNDP-COL-03305),UNDP – UNDP-COL/COLOMBIA,Ambos,América del Sur – Colombia,—,02-Jul-2026,https://procurement-notices.undp.org/view_negotiation.cfm?nego_id=46570,Ambos,Alta,Identificada,,—,,,
"IC/2026/050 - National Consultant for Revenue Analysis & Policy (UNDP-MNG-00676,1)",UNDP – UNDP-MNG/MONGOLIA,Ambos,Global,—,25-Jun-2026,https://procurement-notices.undp.org/view_negotiation.cfm?nego_id=46483,Ambos,Alta,Identificada,,—,,,
Ryan Nehring - IFPRI,IFPRI,Ambos,Global,—,A verificar,https://www.ifpri.org/profile/ryan-nehring,Ambos,Media,Identificada,,—,,,
Call For Proposals,IFAD / FIDA,Ambos,Global,—,29 April 2026,https://www.ifad.org/en/call-for-proposals,Ambos,Alta,Identificada,,—,,,
Josue Niyonsingiza - IFPRI,IFPRI,Ambos,Global,—,A verificar,https://www.ifpri.org/profile/josue-niyonsingiza,Ambos,Media,Identificada,,—,,,
Inicio | Organización de las Naciones Unidas para la Alimentación y la Agricultura,FAO,Ambos,Global,—,A verificar,https://www.fao.org/home/es,Ambos,Media,Identificada,,—,,,
Caracterización de la agricultura familiar en América Latina y el ...,FAO,Ambos,Caribe,—,A verificar,https://www.fao.org/family-farming/detail/es/c/1740487,Ambos,Media,Identificada,,—,,,
IICA en COP30 - IICA,IICA,Ambos,Europa – Roma (Sede OI),—,A verificar,https://iica.int/es/cop30,Ambos,Media,Identificada,,—,,,
Descripción de puesto - Especialista en resiliencia de los sistemas ...,FAO,Ambos,Global,—,A verificar,https://jobs.fao.org/careersection/fao_external/jobdetail.ftl?lang=es&job=2601118,Ambos,Media,Identificada,,—,,,
Insurance and Risk | IFPRI,IFPRI,Ambos,Global,—,A verificar,https://www.ifpri.org/topic/insurance-and-risk,Ambos,Media,Identificada,,—,,,
Mohammad Riad Uddin | IFPRI,IFPRI,Ambos,Global,—,A verificar,https://www.ifpri.org/profile/riad-uddin,Ambos,Media,Identificada,,—,,,
Work With Us: Opportunities at IFPRI | IFPRI,IFPRI,Ambos,Global,—,A verificar,https://www.ifpri.org/landing/work-with-us,Ambos,Media,Identificada,,—,,,
Concurso de casos 2025 - Fontagro,FONTAGRO,Ambos,Caribe – Cuba,—,A verificar,https://fontagro.org/es/iniciativas/concursos/concurso-de-casos-2025,Ambos,Media,Identificada,,—,,,
Fontagro - Inicio,FONTAGRO,Ambos,Global,—,A verificar,https://fontagro.org/es,Ambos,Media,Identificada,,—,,,
Convocatoria 2025,FONTAGRO,Ambos,Global,—,A verificar,https://fontagro.org/es/iniciativas/convocatorias/convocatoria-2025,Ambos,Media,Identificada,,—,,,
Meeting Room Chairs for FAO HQ Rome - UNGM,UNGM / ONU,Ambos,Europa – Roma (Sede OI),—,A verificar,https://www.ungm.org/Public/Notice/38630,Ambos,Media,Identificada,,—,,,
"2026/FNLEB/FNLEB/135338 relaunching of provision of Institutional Strengthening and Organizational Transformation of Lebanon's Ministry of Agriculture: Comprehensive Assessment, Redesign, and Implementation Support",UNGM / ONU,Ambos,Global,—,A verificar,https://www.ungm.org/Public/Notice/289479,Ambos,Media,Identificada,,—,,,
Agrologistics for Modern Family Farms,Banco Mundial,Ambos,Centroamérica – Guatemala,—,A verificar,https://documents1.worldbank.org/curated/en/099210110132219107/pdf/P178022019de1d00b0b4b20b1cb1e4c88b1.pdf,Ambos,Media,Identificada,,—,,,
multi-page.txt - Documents & Reports - World Bank,Banco Mundial,Ambos,Global,—,A verificar,https://documents1.worldbank.org/curated/en/412031468304805171/txt/multi-page.txt,Ambos,Media,Identificada,,—,,,
UN World Food Programme (WFP),PMA / WFP,Ambos,Global,—,3 June 2026,https://www.wfp.org,Ambos,Alta,Identificada,,—,,,
Food Safety,OMS / WHO,Ambos,Europa – Ginebra (Sede OI),—,10 October 2025,https://www.who.int/health-topics/food-safety,Ambos,Alta,Identificada,,—,,,
Policies for the Future of Farming and Food in the European Union (EN),OCDE / OECD,Ambos,Europa – Sede OI,—,A verificar,https://www.oecd.org/content/dam/oecd/en/publications/reports/2023/10/policies-for-the-future-of-farming-and-food-in-the-european-union_1eda4da6/32810cf6-en.pdf,Ambos,Media,Identificada,,—,,,
IFPRI at External Event Archives | IFPRI,IFPRI,Ambos,Europa – Londres (Sede OI),—,A verificar,https://www.ifpri.org/event_category/ifpriatexternalevent,Ambos,Media,Identificada,,—,,,
Policy Seminar Archives - IFPRI,IFPRI,Ambos,Global,—,A verificar,https://www.ifpri.org/event_type/policyseminar,Ambos,Media,Identificada,,—,,,
"Cluster 6: Food, Bioeconomy, Natural Resources, Agriculture and Environment - Research and innovation",Comisión Europea,Ambos,Europa – Sede OI,—,A verificar,https://research-and-innovation.ec.europa.eu/funding/funding-opportunities/funding-programmes-and-open-calls/horizon-europe/cluster-6-food-bioeconomy-natural-resources-agriculture-and-environment_en,Ambos,Media,Identificada,,—,,,
Acción-de-Mitigación-Nacionalmente-Apropiada-NAMA-De-La ...,Banco Mundial,Ambos,Global,—,A verificar,https://documents1.worldbank.org/curated/en/229181642406542199/txt/Acci%C3%B3n-de-Mitigaci%C3%B3n-Nacionalmente-Apropiada-NAMA-De-La-Ganader%C3%ADa-Bovina-Sostenible-en-Colombia.txt,Ambos,Media,Identificada,,—,,,
Who we are | World Food Programme,PMA / WFP,Ambos,Global,—,A verificar,https://www.wfp.org/who-we-are,Ambos,Media,Identificada,,—,,,
[Fonds] Records of the Agriculture and Rural Development Sector,Banco Mundial,Ambos,Global,—,A verificar,https://archivesholdings.worldbank.org/index.php/records-of-agriculture-and-rural-development-sector,Ambos,Media,Identificada,,—,,,
TAC Members | Global Agriculture and Food Security Program,GAFSP,Ambos,Global,—,A verificar,https://www.gafspfund.org/tac-members,Ambos,Media,Identificada,,—,,,
Michael Roberts - McKnight Foundation,McKnight Foundation,Ambos,Global,—,A verificar,https://www.mcknight.org/person/michael-roberts,Ambos,Media,Identificada,,—,,,
McKnight Welcomes Paul Rogé as International Senior Program Officer - McKnight Foundation,McKnight Foundation,Ambos,Global,—,A verificar,https://www.mcknight.org/news-ideas/mcknight-welcomes-paul-roge-as-international-senior-program-officer,Ambos,Media,Identificada,,—,,,
Discovering Climate Solutions Rooted in the Soil - McKnight Foundation,McKnight Foundation,Ambos,Global,—,A verificar,https://www.mcknight.org/news-ideas/discovering-climate-solutions-rooted-soil,Ambos,Media,Identificada,,—,,,
Webinar: Acciones por la sostenibilidad lideradas por mujeres,ALInvest Verde (UE),Ambos,Global,—,A verificar,https://alinvest-verde.eu/es_es/agenda-verde/webinar-acciones-por-la-sostenibilidad-lideradas-por-mujeres,Ambos,Media,Identificada,,—,,,
ILRI | ILRI Asia | Page 17,ILRI,Ambos,Global,—,A verificar,https://asia.ilri.org/category/ilri/page/17,Ambos,Media,Identificada,,—,,,
Health of Ethiopian Animals for Rural Development (HEARD) project final evaluation validation workshop: Draft report,ILRI,Ambos,Global,—,A verificar,https://www.ilri.org/knowledge/publications/health-ethiopian-animals-rural-development-heard-project-final-evaluation,Ambos,Media,Identificada,,—,,,
Peter Ballantyne,ILRI,Ambos,Global,—,A verificar,https://www.ilri.org/people/peter-ballantyne,Ambos,Media,Identificada,,—,,,
Supporting economic growth and climate action through renewable energy: Insights from fish farming in Bolivia | IDRC - International Development Research Centre,IDRC,Ambos,América del Sur – Bolivia,—,A verificar,https://idrc-crdi.ca/en/research-in-action/supporting-economic-growth-and-climate-action-through-renewable-energy-insights,Ambos,Media,Identificada,,—,,,
Natural Resources | IDRC - International Development Research Centre,IDRC,Ambos,Global,—,A verificar,https://idrc-crdi.ca/en/topics/natural-resources,Ambos,Media,Identificada,,—,,,
| IDRC - International Development Research Centre,IDRC,Ambos,Global,—,A verificar,https://idrc-crdi.ca/en/node?page=9,Ambos,Media,Identificada,,—,,,
World Food Programme - UNGM,UNGM / ONU,Ambos,América Latina y Caribe,—,A verificar,https://www.ungm.org/Shared/KnowledgeCenter/Pages/WFP,Ambos,Media,Identificada,,—,,,
International Trade Centre,UNGM / ONU,Ambos,Global,—,A verificar,https://www.ungm.org/Shared/KnowledgeCenter/Pages/ITC,Ambos,Media,Identificada,,—,,,
Social Protection Policy Mapping Consultancy,Sightsavers,Ambos,Global,—,2026-07-05,https://reliefweb.int/job/4216879/social-protection-policy-mapping-consultancy,Ambos,Alta,Identificada,,—,,,
Request for Proposals: Baseline Study for Farmer Visibility Project - Kenya,Heifer International,Ambos,Global,—,2026-07-01,https://reliefweb.int/job/4216761/request-proposals-baseline-study-farmer-visibility-project-kenya,Ambos,Alta,Identificada,,—,,,
Final Evaluation of a nutritional program,ACF,Ambos,Global,—,2026-06-30,https://reliefweb.int/job/4216595/final-evaluation-nutritional-program,Ambos,Alta,Identificada,,—,,,
"cfpto deliver market linked and climate smart, agriculture value chain and vocational skills training and livelihood interventions for Community policing actors (98856)",UNDP – UNDP South Sudan /SOUTH SUDAN,Ambos,Global,—,03-Jul-2026,https://procurement-notices.undp.org/view_notice.cfm?notice_id=98856,Ambos,Alta,Identificada,,—,,,
UNDP/RFP/23/2026-Intergenerational Policy Dialogue Series (UNDP-NPL-00688),UNDP – UNDP-NPL/NEPAL,Firma,Global,—,03-Jul-2026,https://procurement-notices.undp.org/view_negotiation.cfm?nego_id=46697,Empresarial,Alta,Identificada,,—,,,
"Technical Assessment and Design Services for Value Chain Facilities (7 Lots) (UNDP-SYR-00633,1)",UNDP – UNDP-SYR/SYRIAN ARAB REPUBLIC,Ambos,Global,—,05-Jul-2026,https://procurement-notices.undp.org/view_negotiation.cfm?nego_id=46709,Ambos,Alta,Identificada,,—,,,
RfP for technical assistance to promote investment in key agricultural commodity (UNDP-VNM-02204),UNDP – UNDP-VNM/VIET NAM,Firma,Global,—,01-Jul-2026,https://procurement-notices.undp.org/view_negotiation.cfm?nego_id=46654,Empresarial,Alta,Identificada,,—,,,
Regional Youth Innovation Workshop (UNDP-MWI-00958),UNDP – UNDP-MWI/MALAWI,Ambos,Global,—,21-Jun-2026,https://procurement-notices.undp.org/view_negotiation.cfm?nego_id=46667,Ambos,Alta,Identificada,,—,,,
Individual Consultant to Develop LGU Food Circularity Ordinances (UNDP-PHL-00965),UNDP – UNDP-PHL/PHILIPPINES,Individual,Global,—,30-Jun-2026,https://procurement-notices.undp.org/view_negotiation.cfm?nego_id=46648,"ICyT, Productividad y Desarrollo",Alta,Identificada,,—,,,
